content,section
"PhotoCreditPool photo by Carlos BarriaPandas, Ping-Pong and Profits: Chinese Leader Woos U.S. C.E.O.sAmid frosty U.S.-China relations, Xi Jinping emphasized friendship in an address to executives from Apple, Boeing, Nike and others. By Ana Swanson",business
PhotoCreditKai-Otto Melau/Getty ImagesElite Runner Who Rode in a Car During a Race Is Banned for a YearThe ultramarathoner Joasia Zakrzewski acknowledged that she got a lift for two and a half miles of a 50-mile race in April. By Victor Mather,sports
PhotoCreditESA/ATG EuropeA Supernova ‘Destroyed’ Some of Earth’s Ozone for a Few Minutes in 2022A new study suggests that explosive events in space have the potential to temporarily switch off the natural shield that protects us from harmful solar radiation. By Katrina Miller,science
"PhotoCreditHaiyun Jiang for The New York TimesX Races to Contain Damage After Elon Musk Endorses Antisemitic PostIBM, a major advertiser on X, has pulled its spending from the social media platform, whose employees are grappling with what to tell its other advertisers, according to internal messages. By Ryan Mac",technology
"PhotoCreditMaansi Srivastava/The New York TimesDying Broke‘I Wish I Had Known That No One Was Going to Help Me’Adult children discuss the trials of caring for their aging parents: unreliable agencies, a lack of help and dwindling financial resources. By Reed Abelson and Jordan Rau",health
